{"$id":"next_test","$schema":"https://json-schema.org/draft/2020-12/schema","description":"One ranked test recommendation from the planner (EIG/cost, filtered by level/tools).","properties":{"blocked_reasons":{"items":{"type":"string"},"type":"array"},"cost":{"properties":{"minutes":{"type":"number"},"risk":{"enum":[0,1,2,3]},"usd":{"type":"number"}},"type":"object"},"eig_bits":{"description":"Expected information gain in bits.","type":"number"},"expected_outcomes":{"items":{"properties":{"effect":{"additionalProperties":{"type":"number"},"type":"object"},"outcome":{"type":"string"},"p":{"type":"number"}},"type":"object"},"type":"array"},"instructions_by_level":{"type":"object"},"kp_test_ref":{"type":"string"},"min_level":{"enum":["L1","L2","L3"]},"rank":{"type":"integer"},"required_tools":{"items":{"type":"string"},"type":"array"},"safety_gate":{"description":"Gate id, or 'none'. Tests with a gate need checklist confirmation first.","type":"string"},"score":{"type":"number"},"why":{"type":"string"}},"required":["eig_bits","expected_outcomes","kp_test_ref","rank","score","why"],"type":"object"}
