{"cost":{"minutes":2,"risk":0,"usd":0.0},"eig_bits":1.42,"expected_outcomes":[{"effect":{"maf_contaminated":0.1,"vacuum_leak_post_maf":0.75},"outcome":"lean_idle_normal_cruise","p":0.31},{"effect":{"maf_contaminated":0.65,"vacuum_leak_post_maf":0.15},"outcome":"lean_both","p":0.28}],"kp_test_ref":"trim_idle_vs_2500","min_level":"L1","rank":1,"required_tools":[],"safety_gate":"engine_running_outdoors","score":0.71,"why":"Best split between vacuum leak and fuel delivery for this level and toolset."}
